objectid,filename,youtubeid,vimeoid,title,creator,date,description,subject,people,location,latitude,longitude,source,identifier,type,format,language,rights,rightsstatement,credit,exhibitionlabel,onview
MTHM_102,IHIH_ComingSoon.jpg,,,A Yankee in King Arthur's Court,Samuel L. Clemens (Mark Twain),1889,"Yankee in King Arthur's Court. Green cover with Gold embossed title and author and gold and blue embossed design of knight and man in center of front cover, Spine has gold embossed totle, author, and publisher as well as a gold embossed design of a shield. book is 8 1/2"" x 7"" x 1 1/4"". Spine has wear on outside including a small tear at bottom fron measuring aprox 1cm. Cover completely detached from front of book. On 2nd fly page inscription reads""To My Dear Miss Annie Trumbull with the best wishes of the author 1889"" book is 575 pages long and features an advertisement on last page for the publisher. Page 165/166 has top outside corner ripped off, corner is inserted into page. there is corner damage around this area from aprox 147-176. There is a stamp on back fly page bottom right corner ""B4210""",Cultural;Arts;Writing;Econimic;Industry;Printing,Samuel L. Clemens,,,,The Mark Twain House and Museum,102,Image;StillImage,image/jpeg,eng,"Each contributing institution has their own guidelines and rules for use of their collections. The institution is listed as the source of the item. Please contact the individual institution for their terms of use, or reproduction fees, or terms for reproductions. ","Each contributing institution has their own guidelines and rules for use of their collections. The institution is listed as the source of the item. Please contact the individual institution for their terms of use, or reproduction fees, or terms for reproductions. ","The Mark Twain House & Museum, Gift of Annie Trumbull",,Yes
MTHM_113,MTHM_113.jpg,,,The Innocents Abroad,Samuel L. Clemens (Mark Twain),1869,,,,,,,The Mark Twain House and Museum,113,Image;StillImage,image/jpeg,eng,"Each contributing institution has their own guidelines and rules for use of their collections. The institution is listed as the source of the item. Please contact the individual institution for their terms of use, or reproduction fees, or terms for reproductions. ","Each contributing institution has their own guidelines and rules for use of their collections. The institution is listed as the source of the item. Please contact the individual institution for their terms of use, or reproduction fees, or terms for reproductions. ","The Mark Twain House and Museum, Gift of Mrs. Bennett Kentucky",,Yes
MTHM_158-65,MTHM_158-65.jpg,,,Joan of Arc,Samuel L. Clemens (Mark Twain),1896,,,,,,,The Mark Twain House and Museum,158.65,Image;StillImage,image/jpeg,eng,"Each contributing institution has their own guidelines and rules for use of their collections. The institution is listed as the source of the item. Please contact the individual institution for their terms of use, or reproduction fees, or terms for reproductions. ","Each contributing institution has their own guidelines and rules for use of their collections. The institution is listed as the source of the item. Please contact the individual institution for their terms of use, or reproduction fees, or terms for reproductions. ",The Mark Twain House and Museum collections,,
MTHM_163,MTHM_163.jpg,,,Puddn'head Wilson,Samuel L. Clemens (Mark Twain),1894,,,,,,,The Mark Twain House and Museum,163,Image;StillImage,image/jpeg,eng,"Each contributing institution has their own guidelines and rules for use of their collections. The institution is listed as the source of the item. Please contact the individual institution for their terms of use, or reproduction fees, or terms for reproductions. ","Each contributing institution has their own guidelines and rules for use of their collections. The institution is listed as the source of the item. Please contact the individual institution for their terms of use, or reproduction fees, or terms for reproductions. ",The Mark Twain House and Museum collections,,
MTHM_1665-74,IHIH_ComingSoon.jpg,,,Principles of Home Decoration,Candace Wheeler,,"Copy of Principles of Home Decoration. Blue cover. Book is 227 pages, 8 3/4"" x 6 3/4"" x 3/4"". The title and a floral motif are embossed in gold on the front cover. The spine is very worn, and the title is difficult to see. There is wear on edges of cover. Front cover and spine are completly detached from book. Many pages in the front and back are detached. Some pages, including page 15, are torn on outside edges. ",Cultural;Arts;Writing;Econimic;Industry;Printing,Samuel L. Clemens; Candace Wheeler,,,,The Mark Twain House and Museum,1665.74,Image;StillImage,image/jpeg,eng,"Each contributing institution has their own guidelines and rules for use of their collections. The institution is listed as the source of the item. Please contact the individual institution for their terms of use, or reproduction fees, or terms for reproductions. ","Each contributing institution has their own guidelines and rules for use of their collections. The institution is listed as the source of the item. Please contact the individual institution for their terms of use, or reproduction fees, or terms for reproductions. ","The Mark Twain House & Museum, Gift of Miss Janet Howard",,Yes
MTHM_175,MTHM_175.jpg,,,Adventures of Tom Sawyer,Samuel L. Clemens (Mark Twain),1876,"Adventures of Tom Sawyer. Blue cover with gold and black embossing of stars and diamonds with title. Spine has same design with gold embossed title, author, and publisher. Book is 275 pages. Book is 8 3/4"" x 7"" x 1"". Slight wear on outside of spine and corners of cover. Back cover starting to slightly detach from binding. Inscription on inside of fron cover reads ""Mary A Bull 1899 Easton Pa""",Cultural;Arts;Writing;Econimic;Industry;Printing,Samuel L. Clemens (Mark Twain),,,,The Mark Twain House and Museum,175,Image;StillImage,image/jpeg,eng,"Each contributing institution has their own guidelines and rules for use of their collections. The institution is listed as the source of the item. Please contact the individual institution for their terms of use, or reproduction fees, or terms for reproductions. ","Each contributing institution has their own guidelines and rules for use of their collections. The institution is listed as the source of the item. Please contact the individual institution for their terms of use, or reproduction fees, or terms for reproductions. ",The Mark Twain House and Museum collections,,Yes
MTHM_1880-09-11,IHIH_ComingSoon.jpg,,,Telegram,Samuel L. Clemens (Mark Twain),9/11/1880,,Correspondence; Servants,George Griffin; Samuel L. Clemens,,,,The Mark Twain House and Museum,1880.09.11,Image;StillImage,image/jpeg,eng,"Each contributing institution has their own guidelines and rules for use of their collections. The institution is listed as the source of the item. Please contact the individual institution for their terms of use, or reproduction fees, or terms for reproductions. ","Each contributing institution has their own guidelines and rules for use of their collections. The institution is listed as the source of the item. Please contact the individual institution for their terms of use, or reproduction fees, or terms for reproductions. ","The Mark Twain House & Musuem, Perkins Collection",,Yes
MTHM_1929-10-001,IHIH_ComingSoon.jpg,,,Mark Twain Memorial Bookplate,Inez Temple,1929,Pen & Ink Drawing,Culture; Arts; Visual Arts; Drawing; Environment; Built Environment; Buildings/Architecture,Inez Temple,"351 Farmington Ave, Hartford, Connecticut ",41.76705545,-72.70141583,The Mark Twain House and Museum,1929.10.001,Image;StillImage,image/jpeg,eng,"Each contributing institution has their own guidelines and rules for use of their collections. The institution is listed as the source of the item. Please contact the individual institution for their terms of use, or reproduction fees, or terms for reproductions. ","Each contributing institution has their own guidelines and rules for use of their collections. The institution is listed as the source of the item. Please contact the individual institution for their terms of use, or reproduction fees, or terms for reproductions. ","The Mark Twain House & Musuem, Gift of Inez Temple","A bookplate, also known as an ex-libris (meaning �from the books or library of�), is a small label pasted into the front endpaper of a book to indicate ownership. This pen and ink bookplate, designed by Inez Temple, features scenes and motifs from works by Mark Twain.",Yes
MTHM_1929-30,MTHM_1929-30.jpg,,,Child's Windsor Chair,,c. 1880-1890,,,Olivia Susan Clemens; Clara Langdon Clemens; Jane Lampton Clemens,"351 Farmington Ave, Hartford, Connecticut ",41.76705545,-72.70141583,The Mark Twain House and Museum,1929.3,Image;StillImage,image/jpeg,eng,"Each contributing institution has their own guidelines and rules for use of their collections. The institution is listed as the source of the item. Please contact the individual institution for their terms of use, or reproduction fees, or terms for reproductions. ","Each contributing institution has their own guidelines and rules for use of their collections. The institution is listed as the source of the item. Please contact the individual institution for their terms of use, or reproduction fees, or terms for reproductions. ","The Mark Twain House and Museum, Gift of Mrs. Frances M. Edwards, 1929.",Child's chair from the Clemenses nursery in the Hartford house,
MTHM_1930-17,IHIH_ComingSoon.jpg,,,Guest Book,,1908-1910,,Friends,Samuel L. Clemens,"Stormfield, Redding, Connecticut ",41.29097755,-73.4006279,The Mark Twain House and Museum,1930.17,Image;StillImage,image/jpeg,eng,"Each contributing institution has their own guidelines and rules for use of their collections. The institution is listed as the source of the item. Please contact the individual institution for their terms of use, or reproduction fees, or terms for reproductions. ","Each contributing institution has their own guidelines and rules for use of their collections. The institution is listed as the source of the item. Please contact the individual institution for their terms of use, or reproduction fees, or terms for reproductions. ",,,
MTHM_1935-03-001,IHIH_ComingSoon.jpg,,,Mark Twain House,Kenneth Irwin Dike,1935,,Culture; Arts; Visual Arts; Painting; Environment; Built Environment; Buildings/Architecture,Kenneth Irwin Dike,"351 Farmington Ave, Hartford, Connecticut ",41.76705545,-72.70141583,The Mark Twain House and Museum,1935.03.001,Image;StillImage,image/jpeg,eng,"Each contributing institution has their own guidelines and rules for use of their collections. The institution is listed as the source of the item. Please contact the individual institution for their terms of use, or reproduction fees, or terms for reproductions. ","Each contributing institution has their own guidelines and rules for use of their collections. The institution is listed as the source of the item. Please contact the individual institution for their terms of use, or reproduction fees, or terms for reproductions. ","The Mark Twain House & Museum, Gift of Kenneth Erwin Dike ",Watercolor painting of the Mark Twain House by Kenneth Irwin Dike,Yes
MTHM_1942-01,MTHM_1942-01_2024.jpg,,,Crib,,c. 1875,,,Olivia Susan Clemens; Clara Langdon Clemens; Jane Lampton Clemens,"351 Farmington Ave, Hartford, Connecticut ",41.76705545,-72.70141583,The Mark Twain House and Museum,1942.01,Image;StillImage,image/jpeg,eng,"Each contributing institution has their own guidelines and rules for use of their collections. The institution is listed as the source of the item. Please contact the individual institution for their terms of use, or reproduction fees, or terms for reproductions. ","Each contributing institution has their own guidelines and rules for use of their collections. The institution is listed as the source of the item. Please contact the individual institution for their terms of use, or reproduction fees, or terms for reproductions. ","The Mark Twain House & Museum, Museum purchase.","Samuel and Livy Clemens used this crib for their children in the Hartford house. The crib was reportedly given to Clemens� cook, Katharine Duff, who passed it down in her family until it returned to the museum in the early 1940s. ",
MTHM_1943-2,MTHM_1943-2.JPG,,,Sideboard,,c. 1875,"Walnut, burl-walnut veneer, marble sideboard. Oblong pink marble top with ovolo corners above drawered and doored frame having columnar stiles and applied carved ornaments. ",,Samuel L. Clemens (Mark Twain); Olivia Langdon Clemens,"351 Farmington Ave, Hartford, Connecticut ",41.76705545,-72.70141583,The Mark Twain House and Museum,1943.2,Image;StillImage,image/jpeg,eng,"Each contributing institution has their own guidelines and rules for use of their collections. The institution is listed as the source of the item. Please contact the individual institution for their terms of use, or reproduction fees, or terms for reproductions. ","Each contributing institution has their own guidelines and rules for use of their collections. The institution is listed as the source of the item. Please contact the individual institution for their terms of use, or reproduction fees, or terms for reproductions. ","The Mark Twain House and Museum, Gift of Mrs. R. H. Waterman, 1943.",,
MTHM_1956-12-001,IHIH_ComingSoon.jpg,,,Bret Harte Enjoys a Drink at Mark Twain's House,W. Kirkman Plummer,,,Culture; Arts; Visual Arts; Painting; Environment; Built Environment; Buildings/Architecture,Bret Harte; Samuel Langhorne Clemens; W. Kirkman Plummer; National Distillery Company,,38.14672588,-84.84175119,The Mark Twain House and Museum,1956.12.001,Image;StillImage,image/jpeg,eng,"Each contributing institution has their own guidelines and rules for use of their collections. The institution is listed as the source of the item. Please contact the individual institution for their terms of use, or reproduction fees, or terms for reproductions. ","Each contributing institution has their own guidelines and rules for use of their collections. The institution is listed as the source of the item. Please contact the individual institution for their terms of use, or reproduction fees, or terms for reproductions. ","The Mark Twain House & Museum, Gift of National Distillery Company",Painting used by The Old Corw Distillery Company for an advertistment for their bourbon,Yes
MTHM_1956-12-001,IHIH_ComingSoon.jpg,,,Bret Harte Enjoys a Drink at Mark Twain's House,W. Kirkman Plummer,,,Culture; Arts; Visual Arts; Painting; Environment; Built Environment; Buildings/Architecture,Bret Harte; Samuel Langhorne Clemens; W. Kirkman Plummer; National Distillery Company,"351 Farmington Ave, Hartford, Connecticut ",41.76705545,-72.70141583,The Mark Twain House and Museum,1956.12.001,Image;StillImage,image/jpeg,eng,"Each contributing institution has their own guidelines and rules for use of their collections. The institution is listed as the source of the item. Please contact the individual institution for their terms of use, or reproduction fees, or terms for reproductions. ","Each contributing institution has their own guidelines and rules for use of their collections. The institution is listed as the source of the item. Please contact the individual institution for their terms of use, or reproduction fees, or terms for reproductions. ","The Mark Twain House & Museum, Gift of National Distillery Company",Painting used by The Old Corw Distillery Company for an advertistment for their bourbon,Yes
MTHM_1957-P1-ClaraAnnotations,1957-P1-ClaraAnnotations_b.jpg,,,"Floor Plans, Mark Twain Memorial, Annotated by Clara (Clemens) Samossoud - 1st Floor",Clara Langdon Clemens,1957,,Environment; Built Environment; Buildings/Architecture,Clara Langdon Clemens,"351 Farmington Ave, Hartford, Connecticut ",41.76705545,-72.70141583,The Mark Twain House and Museum,1957-P1-ClaraAnnotations,Image;StillImage,image/jpeg,eng,"Each contributing institution has their own guidelines and rules for use of their collections. The institution is listed as the source of the item. Please contact the individual institution for their terms of use, or reproduction fees, or terms for reproductions. ","Each contributing institution has their own guidelines and rules for use of their collections. The institution is listed as the source of the item. Please contact the individual institution for their terms of use, or reproduction fees, or terms for reproductions. ",The Mark Twain Memorial Instistutional Archive,"In 1957 the Mark Twain Library and Memorial Commission hosted Clara Clemens Samossoud at the Hartford home. During her visit she was provided plans for the three main floors and was asked to notate the rooms with her memories of furnishings, layout, and uses. These three floor plans were and continue to be used during the Mark Twain Memorial's restoration efforts. ",Yes
MTHM_1957-P1-ClaraAnnotations,1957-P1-ClaraAnnotations_bd.jpg,,,"Floor Plans, Mark Twain Memorial, Annotated by Clara (Clemens) Samossoud - 1st Floor",Clara Langdon Clemens,1957,,Environment; Built Environment; Buildings/Architecture,Clara Langdon Clemens,"351 Farmington Ave, Hartford, Connecticut ",41.76705545,-72.70141583,The Mark Twain House and Museum,1957-P1-ClaraAnnotations,Image;StillImage,image/jpeg,eng,"Each contributing institution has their own guidelines and rules for use of their collections. The institution is listed as the source of the item. Please contact the individual institution for their terms of use, or reproduction fees, or terms for reproductions. ","Each contributing institution has their own guidelines and rules for use of their collections. The institution is listed as the source of the item. Please contact the individual institution for their terms of use, or reproduction fees, or terms for reproductions. ",The Mark Twain Memorial Instistutional Archive,"In 1957 the Mark Twain Library and Memorial Commission hosted Clara Clemens Samossoud at the Hartford home. During her visit she was provided plans for the three main floors and was asked to notate the rooms with her memories of furnishings, layout, and uses. These three floor plans were and continue to be used during the Mark Twain Memorial's restoration efforts. ",Yes
MTHM_1957-P1-ClaraAnnotations,1957-P1-ClaraAnnotations_d1.jpg,,,"Floor Plans, Mark Twain Memorial, Annotated by Clara (Clemens) Samossoud - 1st Floor",Clara Langdon Clemens,1957,,Environment; Built Environment; Buildings/Architecture,Clara Langdon Clemens,"351 Farmington Ave, Hartford, Connecticut ",41.76705545,-72.70141583,The Mark Twain House and Museum,1957-P1-ClaraAnnotations,Image;StillImage,image/jpeg,eng,"Each contributing institution has their own guidelines and rules for use of their collections. The institution is listed as the source of the item. Please contact the individual institution for their terms of use, or reproduction fees, or terms for reproductions. ","Each contributing institution has their own guidelines and rules for use of their collections. The institution is listed as the source of the item. Please contact the individual institution for their terms of use, or reproduction fees, or terms for reproductions. ",The Mark Twain Memorial Instistutional Archive,"In 1957 the Mark Twain Library and Memorial Commission hosted Clara Clemens Samossoud at the Hartford home. During her visit she was provided plans for the three main floors and was asked to notate the rooms with her memories of furnishings, layout, and uses. These three floor plans were and continue to be used during the Mark Twain Memorial's restoration efforts. ",Yes
MTHM_1957-P1-ClaraAnnotations,1957-P1-ClaraAnnotations_d2.jpg,,,"Floor Plans, Mark Twain Memorial, Annotated by Clara (Clemens) Samossoud - 1st Floor",Clara Langdon Clemens,1957,,Environment; Built Environment; Buildings/Architecture,Clara Langdon Clemens,"351 Farmington Ave, Hartford, Connecticut ",41.76705545,-72.70141583,The Mark Twain House and Museum,1957-P1-ClaraAnnotations,Image;StillImage,image/jpeg,eng,"Each contributing institution has their own guidelines and rules for use of their collections. The institution is listed as the source of the item. Please contact the individual institution for their terms of use, or reproduction fees, or terms for reproductions. ","Each contributing institution has their own guidelines and rules for use of their collections. The institution is listed as the source of the item. Please contact the individual institution for their terms of use, or reproduction fees, or terms for reproductions. ",The Mark Twain Memorial Instistutional Archive,"In 1957 the Mark Twain Library and Memorial Commission hosted Clara Clemens Samossoud at the Hartford home. During her visit she was provided plans for the three main floors and was asked to notate the rooms with her memories of furnishings, layout, and uses. These three floor plans were and continue to be used during the Mark Twain Memorial's restoration efforts. ",Yes
MTHM_1957-P1-ClaraAnnotations,1957-P1-ClaraAnnotations_d3.jpg,,,"Floor Plans, Mark Twain Memorial, Annotated by Clara (Clemens) Samossoud - 1st Floor",Clara Langdon Clemens,1957,,Environment; Built Environment; Buildings/Architecture,Clara Langdon Clemens,"351 Farmington Ave, Hartford, Connecticut ",41.76705545,-72.70141583,The Mark Twain House and Museum,1957-P1-ClaraAnnotations,Image;StillImage,image/jpeg,eng,"Each contributing institution has their own guidelines and rules for use of their collections. The institution is listed as the source of the item. Please contact the individual institution for their terms of use, or reproduction fees, or terms for reproductions. ","Each contributing institution has their own guidelines and rules for use of their collections. The institution is listed as the source of the item. Please contact the individual institution for their terms of use, or reproduction fees, or terms for reproductions. ",The Mark Twain Memorial Instistutional Archive,"In 1957 the Mark Twain Library and Memorial Commission hosted Clara Clemens Samossoud at the Hartford home. During her visit she was provided plans for the three main floors and was asked to notate the rooms with her memories of furnishings, layout, and uses. These three floor plans were and continue to be used during the Mark Twain Memorial's restoration efforts. ",Yes
MTHM_1957-P1-ClaraAnnotations,1957-P1-ClaraAnnotations_d4.jpg,,,"Floor Plans, Mark Twain Memorial, Annotated by Clara (Clemens) Samossoud - 1st Floor",Clara Langdon Clemens,1957,,Environment; Built Environment; Buildings/Architecture,Clara Langdon Clemens,"351 Farmington Ave, Hartford, Connecticut ",41.76705545,-72.70141583,The Mark Twain House and Museum,1957-P1-ClaraAnnotations,Image;StillImage,image/jpeg,eng,"Each contributing institution has their own guidelines and rules for use of their collections. The institution is listed as the source of the item. Please contact the individual institution for their terms of use, or reproduction fees, or terms for reproductions. ","Each contributing institution has their own guidelines and rules for use of their collections. The institution is listed as the source of the item. Please contact the individual institution for their terms of use, or reproduction fees, or terms for reproductions. ",The Mark Twain Memorial Instistutional Archive,"In 1957 the Mark Twain Library and Memorial Commission hosted Clara Clemens Samossoud at the Hartford home. During her visit she was provided plans for the three main floors and was asked to notate the rooms with her memories of furnishings, layout, and uses. These three floor plans were and continue to be used during the Mark Twain Memorial's restoration efforts. ",Yes
MTHM_1957-P1-ClaraAnnotations,1957-P1-ClaraAnnotations_f.jpg,,,"Floor Plans, Mark Twain Memorial, Annotated by Clara (Clemens) Samossoud - 1st Floor",Clara Langdon Clemens,1957,,Environment; Built Environment; Buildings/Architecture,Clara Langdon Clemens,"351 Farmington Ave, Hartford, Connecticut ",41.76705545,-72.70141583,The Mark Twain House and Museum,1957-P1-ClaraAnnotations,Image;StillImage,image/jpeg,eng,"Each contributing institution has their own guidelines and rules for use of their collections. The institution is listed as the source of the item. Please contact the individual institution for their terms of use, or reproduction fees, or terms for reproductions. ","Each contributing institution has their own guidelines and rules for use of their collections. The institution is listed as the source of the item. Please contact the individual institution for their terms of use, or reproduction fees, or terms for reproductions. ",The Mark Twain Memorial Instistutional Archive,"In 1957 the Mark Twain Library and Memorial Commission hosted Clara Clemens Samossoud at the Hartford home. During her visit she was provided plans for the three main floors and was asked to notate the rooms with her memories of furnishings, layout, and uses. These three floor plans were and continue to be used during the Mark Twain Memorial's restoration efforts. ",Yes
