objectid,filename,youtubeid,vimeoid,title,creator,date,description,subject,people,location,latitude,longitude,source,identifier,type,format,language,rights,rightsstatement,credit,exhibitionlabel,onview
MTHM_753-72,MTHM_753-72_ID-3_20240804.jpg,,,"Salesman's Prospectus for ""Adventures of Huckleberry Finn"" ",Samuel L. Clemens (Mark Twain),1885,,Cultural; Arts; Visual Arts; Photography; Environmental; Built Environment; Buildings/Architecture; Civil Engineering,Samuel L. Clemens (Mark Twain); Charles Webster & Company,"Corrner of Pearl & Trumbull, Hartford, Connecticut",41.76635,-72.67592,The Mark Twain House and Museum,753.72,Image;StillImage,image/jpeg,eng,"Each contributing institution has their own guidelines and rules for use of their collections. The institution is listed as the source of the item. Please contact the individual institution for their terms of use, or reproduction fees, or terms for reproductions. ","Each contributing institution has their own guidelines and rules for use of their collections. The institution is listed as the source of the item. Please contact the individual institution for their terms of use, or reproduction fees, or terms for reproductions. ","The Mark Twain House and Museum, Gift of Jonathan Goodwin",,
MTHM_775-72,MTHM_775-72.jpg,,,The Mysterious Stranger,Samuel L. Clemens (Mark Twain),1916,,,,,,,The Mark Twain House and Museum,775.72,Image;StillImage,image/jpeg,eng,"Each contributing institution has their own guidelines and rules for use of their collections. The institution is listed as the source of the item. Please contact the individual institution for their terms of use, or reproduction fees, or terms for reproductions. ","Each contributing institution has their own guidelines and rules for use of their collections. The institution is listed as the source of the item. Please contact the individual institution for their terms of use, or reproduction fees, or terms for reproductions. ",The Mark Twain House and Museum collections,,
MTHM_786-72,MTHM_786-72.jpg,,,Following the Equator,Samuel L. Clemens (Mark Twain),1897,,,,,,,The Mark Twain House and Museum,786.72,Image;StillImage,image/jpeg,eng,"Each contributing institution has their own guidelines and rules for use of their collections. The institution is listed as the source of the item. Please contact the individual institution for their terms of use, or reproduction fees, or terms for reproductions. ","Each contributing institution has their own guidelines and rules for use of their collections. The institution is listed as the source of the item. Please contact the individual institution for their terms of use, or reproduction fees, or terms for reproductions. ","The Mark Twain House and Museum, Gift of Jonathan Goodwin",,
MTHM_88-64,MTHM_88-64.jpg,,,Extracts from Adam's Diary,Samuel L. Clemens (Mark Twain),1904,,,,,,,The Mark Twain House and Museum,88.64,Image;StillImage,image/jpeg,eng,"Each contributing institution has their own guidelines and rules for use of their collections. The institution is listed as the source of the item. Please contact the individual institution for their terms of use, or reproduction fees, or terms for reproductions. ","Each contributing institution has their own guidelines and rules for use of their collections. The institution is listed as the source of the item. Please contact the individual institution for their terms of use, or reproduction fees, or terms for reproductions. ",The Mark Twain House and Museum collections,,
MTHM_Ad-23-C1,Advertisement23_c1_f.jpg,,,Old Crow Advertisement featuring Mark Twain and Bret Harte in the Hartford House Dining Room,Old Crow,,,Culture; Arts; Visual Arts; Drawing; Environment; Built Environment; Buildings/Architecture; Economic; Consumer; Social; Personal Relationships; Friends,Sameul L. Clemens (Mark Twain); Bret Harte,"351 Farmington Ave, Hartford, Connecticut ",41.76705545,-72.70141583,The Mark Twain House and Museum,Advertisement 23 C.1,Image;StillImage,image/jpeg,eng,"Each contributing institution has their own guidelines and rules for use of their collections. The institution is listed as the source of the item. Please contact the individual institution for their terms of use, or reproduction fees, or terms for reproductions. ","Each contributing institution has their own guidelines and rules for use of their collections. The institution is listed as the source of the item. Please contact the individual institution for their terms of use, or reproduction fees, or terms for reproductions. ",The Mark Twain House and Museum,,Yes
MTHM_Ad-23-C1,Advertisement23_c1_b.jpg,,,Old Crow Advertisement featuring Mark Twain and Bret Harte in the Hartford House Dining Room,Old Crow,,,Culture; Arts; Visual Arts; Drawing; Environment; Built Environment; Buildings/Architecture; Economic; Consumer; Social; Personal Relationships; Friends,Sameul L. Clemens (Mark Twain); Bret Harte,"351 Farmington Ave, Hartford, Connecticut ",41.76705545,-72.70141583,The Mark Twain House and Museum,Advertisement 23 C.1,Image;StillImage,image/jpeg,eng,"Each contributing institution has their own guidelines and rules for use of their collections. The institution is listed as the source of the item. Please contact the individual institution for their terms of use, or reproduction fees, or terms for reproductions. ","Each contributing institution has their own guidelines and rules for use of their collections. The institution is listed as the source of the item. Please contact the individual institution for their terms of use, or reproduction fees, or terms for reproductions. ",The Mark Twain House and Museum,,Yes
MTHM_Bissell-Marie,MTHM_Bissell-Marie.jpg,,,Marie Bissell and her chidlren,,,,,,,,,The Mark Twain House and Museum,Marie Bissell & children,Image;StillImage,image/jpeg,eng,"Each contributing institution has their own guidelines and rules for use of their collections. The institution is listed as the source of the item. Please contact the individual institution for their terms of use, or reproduction fees, or terms for reproductions. ","Each contributing institution has their own guidelines and rules for use of their collections. The institution is listed as the source of the item. Please contact the individual institution for their terms of use, or reproduction fees, or terms for reproductions. ",The Mark Twain House & Museum collections,,
MTHM_Candace-Wheeler-15,Candace-Wheeler-15.jpg,,,Portrait of Candace Wheeler,Unidenjpgied photographer,1910-1923,,,,,,,The Mark Twain House and Museum,Candace Wheeler -15,Image;StillImage,image/jpeg,eng,"Each contributing institution has their own guidelines and rules for use of their collections. The institution is listed as the source of the item. Please contact the individual institution for their terms of use, or reproduction fees, or terms for reproductions. ","Each contributing institution has their own guidelines and rules for use of their collections. The institution is listed as the source of the item. Please contact the individual institution for their terms of use, or reproduction fees, or terms for reproductions. ",The Mark Twain House and Museum collections,,
MTHM_CC-1983,IHIH_ComingSoon.jpg,,,Letter From Samuel Clemens to Charles F. Wingate,Samuel L. Clemens (Mark Twain),1873,"Two pages of letter from Samuel Clemens to Charles Wingate. 1st page is original, 2nd is copy. 1st page is 7"" x 4 1/2"", 2nd page is 6 3/4"" x 4 1/2"". There is a monogram on top center of 1st page with Samuel Clemens initals. Top left corner of 1st page is written in different script ""B Nov 1835 in Florida S. L. Clemens Mark Twain"" in top left corner dated in pencil ""1873 Wingate"" Letter explains why Clemmens will be unable to leave home for at least 2 weeks, as he is writing a book and does not know when he will be done. It is signed Samuel L. Clemens and is written ""Chas. F Wingate Esq"" under signature. First page shows two folds in it as it was folded in thirds. ",Social;Personal Relationships;Friends,Samuel L. Clemens; Charles F. Wingate,,,,The Mark Twain House and Museum,1983,Image;StillImage,image/jpeg,eng,"Each contributing institution has their own guidelines and rules for use of their collections. The institution is listed as the source of the item. Please contact the individual institution for their terms of use, or reproduction fees, or terms for reproductions. ","Each contributing institution has their own guidelines and rules for use of their collections. The institution is listed as the source of the item. Please contact the individual institution for their terms of use, or reproduction fees, or terms for reproductions. ","The Mark Twain House & Museum, Cyril Clemens Collection","In April 1873, Samuel Clemens was working with friend and Nook Farm neighbor Charles Dudley Warner on their book The Gilded Age, which criticized post-Civil War American and gave the era in which they lived the name Gilded Age. The book was being published by the American Publishing Company here in Hartford. The letter seen here to Charles F. Windgate is written from Hartford and shows the balancing act Clemens maintained between traveling and staying in Hartford to write. 
Dear Sir: 
I shall be here at home some three weeks yet, & possibly longer. I cannot therefore tell exactly when I shall be in New York. But I stop at the St. Nicholas Hotel always, & if you should glance at the hotel arrivals in The Tribune you would see when I come & then I would be glad if you dropped in. The reason I cannot be more positive as to the day I shall leave here is that I am finishing a book & I find it impossible to tell exactly when I am going to get it done. 
Very truly Yours,
 Samuel L. Clemens  ",Yes
MTHM_CC-1983,IHIH_ComingSoon.jpg,,,Letter From Samuel Clemens to Charles F. Wingate,Samuel L. Clemens (Mark Twain),1873,"Two pages of letter from Samuel Clemens to Charles Wingate. 1st page is original, 2nd is copy. 1st page is 7"" x 4 1/2"", 2nd page is 6 3/4"" x 4 1/2"". There is a monogram on top center of 1st page with Samuel Clemens initals. Top left corner of 1st page is written in different script ""B Nov 1835 in Florida S. L. Clemens Mark Twain"" in top left corner dated in pencil ""1873 Wingate"" Letter explains why Clemmens will be unable to leave home for at least 2 weeks, as he is writing a book and does not know when he will be done. It is signed Samuel L. Clemens and is written ""Chas. F Wingate Esq"" under signature. First page shows two folds in it as it was folded in thirds. ",Social;Personal Relationships;Friends,Samuel L. Clemens; Charles F. Wingate,,,,The Mark Twain House and Museum,1983,Image;StillImage,image/jpeg,eng,"Each contributing institution has their own guidelines and rules for use of their collections. The institution is listed as the source of the item. Please contact the individual institution for their terms of use, or reproduction fees, or terms for reproductions. ","Each contributing institution has their own guidelines and rules for use of their collections. The institution is listed as the source of the item. Please contact the individual institution for their terms of use, or reproduction fees, or terms for reproductions. ","The Mark Twain House & Museum, Cyril Clemens Collection","In April 1873, Samuel Clemens was working with friend and Nook Farm neighbor Charles Dudley Warner on their book The Gilded Age, which criticized post-Civil War American and gave the era in which they lived the name Gilded Age. The book was being published by the American Publishing Company here in Hartford. The letter seen here to Charles F. Windgate is written from Hartford and shows the balancing act Clemens maintained between traveling and staying in Hartford to write. 
Dear Sir: 
I shall be here at home some three weeks yet, & possibly longer. I cannot therefore tell exactly when I shall be in New York. But I stop at the St. Nicholas Hotel always, & if you should glance at the hotel arrivals in The Tribune you would see when I come & then I would be glad if you dropped in. The reason I cannot be more positive as to the day I shall leave here is that I am finishing a book & I find it impossible to tell exactly when I am going to get it done. 
Very truly Yours,
 Samuel L. Clemens  ",Yes
MTHM_ChildrenGroups9,ChildrenPhotos-Groups-9,,,Clara Clemens and Margaret Warner,H.E. Lay,c.1888,,Cultural; Arts; Visual Arts; Photography; Social; Sports & Recreaction; Athletics; Personal Relationships; friendship,Clara Langdon Clemens; Margaret Warner,"181 Main Street, Hartford, Connecticut",41.75811367,-72.67594707,The Mark Twain House and Museum,ChildrenPhotos-Groups-9,Image;StillImage,image/jpeg,eng,"Each contributing institution has their own guidelines and rules for use of their collections. The institution is listed as the source of the item. Please contact the individual institution for their terms of use, or reproduction fees, or terms for reproductions. ","Each contributing institution has their own guidelines and rules for use of their collections. The institution is listed as the source of the item. Please contact the individual institution for their terms of use, or reproduction fees, or terms for reproductions. ",The Mark Twain House and Museum collections,"Clara Clemens and Margaret Warner, c.1888, tintype by H.E.Lay. MTH&M Collections.",
MTHM_Church_Asylum-Hill,MTHM_Church_Asylum-Hill.jpg,,,Asylum Hill Congregational Church,,1870s-1880s,,,,,,,The Mark Twain House and Museum,Asylum Hill Congregational Church,Image;StillImage,image/jpeg,eng,"Each contributing institution has their own guidelines and rules for use of their collections. The institution is listed as the source of the item. Please contact the individual institution for their terms of use, or reproduction fees, or terms for reproductions. ","Each contributing institution has their own guidelines and rules for use of their collections. The institution is listed as the source of the item. Please contact the individual institution for their terms of use, or reproduction fees, or terms for reproductions. ",The Mark Twain House & Museum collections,,
MTHM_Clara-before-marriage3,MTHM_Clara-before-marriage3.jpg,,,Portrait of Clara Langdon Clemens,,1878,,social; personal relationships; faily; identity; cultural; Arts; visual arts; photography,Clara Langdon Clemens,"Munich, Germany",48.1351,-11.582,The Mark Twain House and Museum,Childrens Photos Clara before marriage -3,Image;StillImage,image/jpeg,eng,"Each contributing institution has their own guidelines and rules for use of their collections. The institution is listed as the source of the item. Please contact the individual institution for their terms of use, or reproduction fees, or terms for reproductions. ","Each contributing institution has their own guidelines and rules for use of their collections. The institution is listed as the source of the item. Please contact the individual institution for their terms of use, or reproduction fees, or terms for reproductions. ",The Mark Twain House and Museum collections,"Photograph of Clara Langdon Clemens taken in Munic, Germany at age 4 (1878)",
MTHM_Clara-before-marriage5,MTHM_Clara-before-marriage5.jpg,,,Clara with Jumbo,Horace L. Bundy,c. 1884,,,,,,,The Mark Twain House and Museum,Clara before marriage -5,Image;StillImage,image/jpeg,eng,"Each contributing institution has their own guidelines and rules for use of their collections. The institution is listed as the source of the item. Please contact the individual institution for their terms of use, or reproduction fees, or terms for reproductions. ","Each contributing institution has their own guidelines and rules for use of their collections. The institution is listed as the source of the item. Please contact the individual institution for their terms of use, or reproduction fees, or terms for reproductions. ","The Mark Twain House and Museum, Gift Olivia Loomis Lada-Mocarski",,
MTHM_ClaraSamossoud11,MTHM_ClaraSamossoud11.jpg,,,Clara & Jacques Samossoud,,c.1944-1949,,,,,,,The Mark Twain House and Museum,Childrens Photos Clara Samossoud -11,Image;StillImage,image/jpeg,eng,"Each contributing institution has their own guidelines and rules for use of their collections. The institution is listed as the source of the item. Please contact the individual institution for their terms of use, or reproduction fees, or terms for reproductions. ","Each contributing institution has their own guidelines and rules for use of their collections. The institution is listed as the source of the item. Please contact the individual institution for their terms of use, or reproduction fees, or terms for reproductions. ",The Mark Twain House and Museum collections,,
MTHM_Decorators_Lockwood-deForest_01,MTHM_Decorators_Lockwood-deForest_01.jpg,,,Portrait of Lockwood de Forest,,,,,,,,,The Mark Twain House and Museum,MTHM_Decorators_Lockwood-deForest_01,Image;StillImage,image/jpeg,eng,"Each contributing institution has their own guidelines and rules for use of their collections. The institution is listed as the source of the item. Please contact the individual institution for their terms of use, or reproduction fees, or terms for reproductions. ","Each contributing institution has their own guidelines and rules for use of their collections. The institution is listed as the source of the item. Please contact the individual institution for their terms of use, or reproduction fees, or terms for reproductions. ",The Mark Twain House & Museum collections,,
MTHM_Decorators-AA-1879-1883_11,MTHM_Decorators-AA-1879-1883_11.jpg,,,The Veterans' Room,Scribner's Vol. XXII,1879-1883,,,,,,,The Mark Twain House and Museum,Decorators Associated Artists 1879-1883 -11,Image;StillImage,image/jpeg,eng,"Each contributing institution has their own guidelines and rules for use of their collections. The institution is listed as the source of the item. Please contact the individual institution for their terms of use, or reproduction fees, or terms for reproductions. ","Each contributing institution has their own guidelines and rules for use of their collections. The institution is listed as the source of the item. Please contact the individual institution for their terms of use, or reproduction fees, or terms for reproductions. ",The Mark Twain House & Museum collections,,
MTHM_EarlySketch,MTHM_EarlySketch.jpg,,,Early Sketch of Mark Twain House,,,,,,,,,The Mark Twain House and Museum,Early MTH sketch,Image;StillImage,image/jpeg,eng,"Each contributing institution has their own guidelines and rules for use of their collections. The institution is listed as the source of the item. Please contact the individual institution for their terms of use, or reproduction fees, or terms for reproductions. ","Each contributing institution has their own guidelines and rules for use of their collections. The institution is listed as the source of the item. Please contact the individual institution for their terms of use, or reproduction fees, or terms for reproductions. ",The Mark Twain House and Museum collections,,
MTHM_EdwardPotter,EdwardPotter.jpg,,,Portrait of Edward Tuckerman Potter,,,,,,,,,The Mark Twain House and Museum,Edward T. Potter,Image;StillImage,image/jpeg,eng,"Each contributing institution has their own guidelines and rules for use of their collections. The institution is listed as the source of the item. Please contact the individual institution for their terms of use, or reproduction fees, or terms for reproductions. ","Each contributing institution has their own guidelines and rules for use of their collections. The institution is listed as the source of the item. Please contact the individual institution for their terms of use, or reproduction fees, or terms for reproductions. ",The Mark Twain House and Museum collections,,
MTHM_Employees_Oneil_06,MTHM_Employees_Oneil_06.JPG,,,John & Ellen O'Neil,,1905,,,,,,," The Mark Twain Papers, Bancroft Library, University of California at Berkeley",MTHM_Employees_Oneil_06,Image;StillImage,image/jpeg,eng,"Each contributing institution has their own guidelines and rules for use of their collections. The institution is listed as the source of the item. Please contact the individual institution for their terms of use, or reproduction fees, or terms for reproductions. ","Each contributing institution has their own guidelines and rules for use of their collections. The institution is listed as the source of the item. Please contact the individual institution for their terms of use, or reproduction fees, or terms for reproductions. ","Image courtesy of The Mark Twain Papers, Bancroft Library, University of California at Berkeley",,
MTHM_Employees_Rosa,MTHM_Employees_Rosa.jpg,,,Rosina Hay,Horace L. Bundy,,,,,,,,The Mark Twain House and Museum,MTHM_Employees_Rosa,Image;StillImage,image/jpeg,eng,"Each contributing institution has their own guidelines and rules for use of their collections. The institution is listed as the source of the item. Please contact the individual institution for their terms of use, or reproduction fees, or terms for reproductions. ","Each contributing institution has their own guidelines and rules for use of their collections. The institution is listed as the source of the item. Please contact the individual institution for their terms of use, or reproduction fees, or terms for reproductions. ","The Mark Twain House & Museum, Gift of Olivia Lada-Mocarski",,
MTHM_Employees01,MTHM_Employees_Patrick.jpg,,,Patrick McAleer,,,,,,,,,The Mark Twain House and Museum,Employees -1 Patrick McAleer,Image;StillImage,image/jpeg,eng,"Each contributing institution has their own guidelines and rules for use of their collections. The institution is listed as the source of the item. Please contact the individual institution for their terms of use, or reproduction fees, or terms for reproductions. ","Each contributing institution has their own guidelines and rules for use of their collections. The institution is listed as the source of the item. Please contact the individual institution for their terms of use, or reproduction fees, or terms for reproductions. ",The Mark Twain House and Museum collections,,
MTHM_Employees-13,MTHM_Employees-13.jpg,,,Tintype portrait of Mary Ann Cord (1798-1888),Unknown,c.1855-1865,"This photograph is a tintype, which is a photograph made by creating a direct positive on a thin sheet of metal. Tintypes were often used for portraits between 1853 when it was introduced by Adolphe Alexandre Martine) and the mid-1860s. This black and white portrait was mostly likely taken in a photographers studio. It depicts an African-American worman standing on a rug, next to a chair and with windows behind her to the proper left. The woman is wearing a black, long-sleeved, mid-thigh legnth top and a white floor-legthen skirt. Her right hand is resting on the back/top of the tuffeted arm chair. The chair has wooden arms and lefts but the seat, back, and arms are covered in what appears to be velvet-like fabric. The woman's top has a collar and buttons down the front. The woman's hiar is platted and tied up on the back of her head; a part just left of center is prominate. The woman's body is posed at a slight angle to the camera with her left shoulder and arm closer to the camera; however, the woman's head is turned to peer directly at the camera/viewer. She has a slight smile on her face. There may be something in the woman's left hand but what it is in unidefiable. The photograph has a white boarder with no text written to identify the subject or photographer. The woman has been identified as Mary Ann Cord. ",Social; Identity; Cultural; Arts; Race/Ethnicity; Visual Arts; Photogrpahy; Economic; Business; Consumer; Technology/Innovation/Invention,Mary Ann Cord,"Elmira, New York",42.0897022,-76.80803859,The Mark Twain House and Museum,Employees-13,Image;StillImage,image/jpeg,eng,"Each contributing institution has their own guidelines and rules for use of their collections. The institution is listed as the source of the item. Please contact the individual institution for their terms of use, or reproduction fees, or terms for reproductions. ","Each contributing institution has their own guidelines and rules for use of their collections. The institution is listed as the source of the item. Please contact the individual institution for their terms of use, or reproduction fees, or terms for reproductions. ",The Mark Twain House & Museum Collections,"Mary Ann Cord  (1798-1888), liberated from slavery during the Civil War, worked as a cook at Quarry Farm. Clemens heard her life story while staying in Elmira in the summer of 1874. Publishing it in the Atlantic Monthly the same year, he titled it “A True Story: Repeated Word for Word as I Heard It.” He changed her name to “Aunt Rachel.”
 
Cord’s son Henry, a barber in Elmira, brought her to the city, where she married Primus Cord and lived out her life working “in service” with several families. She died at age 80 in 1888 and is buried in the same cemetery as the Clemens and Langdon families.",
MTHM_Employees21,MTHM_Employees-KatyLeary.jpg,,,Katy Leary,Horace L. Bundy,,,,,,,,The Mark Twain House and Museum,Employees -21 Katy Leary,Image;StillImage,image/jpeg,eng,"Each contributing institution has their own guidelines and rules for use of their collections. The institution is listed as the source of the item. Please contact the individual institution for their terms of use, or reproduction fees, or terms for reproductions. ","Each contributing institution has their own guidelines and rules for use of their collections. The institution is listed as the source of the item. Please contact the individual institution for their terms of use, or reproduction fees, or terms for reproductions. ","The Mark Twain House and Mueum, Gift in memory of Marguerite Leary Conway, 2005",,
