objectid,filename,youtubeid,vimeoid,title,creator,date,description,subject,people,location,latitude,longitude,source,identifier,type,format,language,rights,rightsstatement,credit,exhibitionlabel,onview
MTHM_2012-15-001,2012-15-001_b.jpg,,,Embroidered Boy Scout of America Patch,,,,Culture; Arts; Visual Arts; Environment; Built Environment; Buildings/Architecture; Social; Clubs/Organizations; Scouting; Fashion; Adornment;,,"351 Farmington Ave, Hartford, Connecticut ",41.76705545,-72.70141583,The Mark Twain House and Museum,2012.15.001,Image;StillImage,image/jpeg,eng,"Each contributing institution has their own guidelines and rules for use of their collections. The institution is listed as the source of the item. Please contact the individual institution for their terms of use, or reproduction fees, or terms for reproductions. ","Each contributing institution has their own guidelines and rules for use of their collections. The institution is listed as the source of the item. Please contact the individual institution for their terms of use, or reproduction fees, or terms for reproductions. ","The Mark Twain House and Museum, Gift of the Connecticut Rivers Council",A 2012 Connecticut Rivers Council of the Friends of Scouting patch with the Mark Twain House embroidered on the front.,Yes
MTHM_2012-15-001,2012-15-001_f.jpg,,,Embroidered Boy Scout of America Patch,,,,Culture; Arts; Visual Arts; Environment; Built Environment; Buildings/Architecture; Social; Clubs/Organizations; Scouting; Fashion; Adornment;,,"351 Farmington Ave, Hartford, Connecticut ",41.76705545,-72.70141583,The Mark Twain House and Museum,2012.15.001,Image;StillImage,image/jpeg,eng,"Each contributing institution has their own guidelines and rules for use of their collections. The institution is listed as the source of the item. Please contact the individual institution for their terms of use, or reproduction fees, or terms for reproductions. ","Each contributing institution has their own guidelines and rules for use of their collections. The institution is listed as the source of the item. Please contact the individual institution for their terms of use, or reproduction fees, or terms for reproductions. ","The Mark Twain House and Museum, Gift of the Connecticut Rivers Council",A 2012 Connecticut Rivers Council of the Friends of Scouting patch with the Mark Twain House embroidered on the front.,Yes
MTHM_2013-20-001,2013-20-1_f_20240805.jpg,,,Ribbon from the Hartford Battalion Welcoming Ulysses S. Grant to Hartford,Hartford Battalion,10/16/1880,,Political; Memory & Commemoration; Cultural,Ulysses S. Grant,,,,The Mark Twain House and Museum,2013.20.001,Image;StillImage,image/jpeg,eng,"Each contributing institution has their own guidelines and rules for use of their collections. The institution is listed as the source of the item. Please contact the individual institution for their terms of use, or reproduction fees, or terms for reproductions. ","Each contributing institution has their own guidelines and rules for use of their collections. The institution is listed as the source of the item. Please contact the individual institution for their terms of use, or reproduction fees, or terms for reproductions. ","The Mark Twain House and Museum, Museum Purchase.",,
MTHM_2013-20-001,2013-20-1_b_20240805.jpg,,,Ribbon from the Hartford Battalion Welcoming Ulysses S. Grant to Hartford,Hartford Battalion,10/16/1880,,Political; Memory & Commemoration; Cultural,Ulysses S. Grant,,,,The Mark Twain House and Museum,2013.20.001,Image;StillImage,image/jpeg,eng,"Each contributing institution has their own guidelines and rules for use of their collections. The institution is listed as the source of the item. Please contact the individual institution for their terms of use, or reproduction fees, or terms for reproductions. ","Each contributing institution has their own guidelines and rules for use of their collections. The institution is listed as the source of the item. Please contact the individual institution for their terms of use, or reproduction fees, or terms for reproductions. ","The Mark Twain House and Museum, Museum Purchase.",,
MTHM_2013-22-001,2013-21-1_f1_20231018.jpg,,,Cufflinks,Dwight H. Buell,,,Economic; Industry; Business; Cultural; Fashion; Adornment,Dwight H. Buell; Samuel L. Clemens (Mark Twain),"State House Square, Hartford, Connecticut",41.76647725,-72.67232611,The Mark Twain House and Museum,2013.22.001,Image;StillImage,image/jpeg,eng,"Each contributing institution has their own guidelines and rules for use of their collections. The institution is listed as the source of the item. Please contact the individual institution for their terms of use, or reproduction fees, or terms for reproductions. ","Each contributing institution has their own guidelines and rules for use of their collections. The institution is listed as the source of the item. Please contact the individual institution for their terms of use, or reproduction fees, or terms for reproductions. ","The Mark Twain House and Museum, Gift of Alice C. Townes and Col. James E. Townes, Jr.",,
MTHM_2013-22-001,2013-21-1_f2_20231018.jpg,,,Cufflinks,Dwight H. Buell,,,Economic; Industry; Business; Cultural; Fashion; Adornment,Dwight H. Buell; Samuel L. Clemens (Mark Twain),"State House Square, Hartford, Connecticut",41.76647725,-72.67232611,The Mark Twain House and Museum,2013.22.001,Image;StillImage,image/jpeg,eng,"Each contributing institution has their own guidelines and rules for use of their collections. The institution is listed as the source of the item. Please contact the individual institution for their terms of use, or reproduction fees, or terms for reproductions. ","Each contributing institution has their own guidelines and rules for use of their collections. The institution is listed as the source of the item. Please contact the individual institution for their terms of use, or reproduction fees, or terms for reproductions. ","The Mark Twain House and Museum, Gift of Alice C. Townes and Col. James E. Townes, Jr.",,
MTHM_2013-22-001,2013-21-1_f3_20231018.jpg,,,Cufflinks,Dwight H. Buell,,,Economic; Industry; Business; Cultural; Fashion; Adornment,Dwight H. Buell; Samuel L. Clemens (Mark Twain),"State House Square, Hartford, Connecticut",41.76647725,-72.67232611,The Mark Twain House and Museum,2013.22.001,Image;StillImage,image/jpeg,eng,"Each contributing institution has their own guidelines and rules for use of their collections. The institution is listed as the source of the item. Please contact the individual institution for their terms of use, or reproduction fees, or terms for reproductions. ","Each contributing institution has their own guidelines and rules for use of their collections. The institution is listed as the source of the item. Please contact the individual institution for their terms of use, or reproduction fees, or terms for reproductions. ","The Mark Twain House and Museum, Gift of Alice C. Townes and Col. James E. Townes, Jr.",,
MTHM_2017-12-001,IHIH_ComingSoon.jpg,,,Mark Twain Memorial Ashtray,Mark Twain Memorial,,,Culture; Socail; Economic; Consumer; Environment; Built Environment; Buildings/Architecture,,"351 Farmington Ave, Hartford, Connecticut ",41.76705545,-72.70141583,The Mark Twain House and Museum,2017.12.1,Image;StillImage,image/jpeg,eng,"Each contributing institution has their own guidelines and rules for use of their collections. The institution is listed as the source of the item. Please contact the individual institution for their terms of use, or reproduction fees, or terms for reproductions. ","Each contributing institution has their own guidelines and rules for use of their collections. The institution is listed as the source of the item. Please contact the individual institution for their terms of use, or reproduction fees, or terms for reproductions. ","The Mark Twain House & Musuem, Gift of Laura VanDin and Andrea Easton","Glass ashtray with black illustration of the Mark Twain House on bottom with the text ""Mark Twain Memorial"" underneath the house. Each corner has a cigarette holder notch in it. ",Yes
MTHM_2019-01-001,IHIH_ComingSoon.jpg,,,The Mark Twain House,Charles H. Overly,undated,Color drawing,Culture; Arts; Visual Arts; Drawing; Environment; Built Environment; Buildings/Architecture,Charles H. Overly,"351 Farmington Ave, Hartford, Connecticut ",41.76705545,-72.70141583,The Mark Twain House and Museum,2019.01.0011,Image;StillImage,image/jpeg,eng,"Each contributing institution has their own guidelines and rules for use of their collections. The institution is listed as the source of the item. Please contact the individual institution for their terms of use, or reproduction fees, or terms for reproductions. ","Each contributing institution has their own guidelines and rules for use of their collections. The institution is listed as the source of the item. Please contact the individual institution for their terms of use, or reproduction fees, or terms for reproductions. ",The Mark Twain House & Museum Collections,Pencil drawing of the Mark Twain House by Charles H. Overly,Yes
MTHM_2022-03-001,IHIH_ComingSoon.jpg,,,MTMTMTMT,Unknown,,,Culture; Arts; Visual Arts; Drawing; Environment; Built Environment; Buildings/Architecture,,"351 Farmington Ave, Hartford, Connecticut ",41.76705545,-72.70141583,The Mark Twain House and Museum,2022.03.001,Image;StillImage,image/jpeg,eng,"Each contributing institution has their own guidelines and rules for use of their collections. The institution is listed as the source of the item. Please contact the individual institution for their terms of use, or reproduction fees, or terms for reproductions. ","Each contributing institution has their own guidelines and rules for use of their collections. The institution is listed as the source of the item. Please contact the individual institution for their terms of use, or reproduction fees, or terms for reproductions. ","The Mark Twain House & Musuem, Gift of Arthur J. Ballelli",,Yes
MTHM_2022-12-001,IHIH_ComingSoon.jpg,,,Mark Twain Library (Conservatory),John Hawkins,c.1980s,Woodblock print,Culture; Arts; Visual Arts; Etching; Environment; Built Environment; Buildings/Architecture,John Hawkins,"351 Farmington Ave, Hartford, Connecticut ",41.76705545,-72.70141583,The Mark Twain House and Museum,2022.12.1,Image;StillImage,image/jpeg,eng,"Each contributing institution has their own guidelines and rules for use of their collections. The institution is listed as the source of the item. Please contact the individual institution for their terms of use, or reproduction fees, or terms for reproductions. ","Each contributing institution has their own guidelines and rules for use of their collections. The institution is listed as the source of the item. Please contact the individual institution for their terms of use, or reproduction fees, or terms for reproductions. ","The Mark Twain House & Museum, Gift of Mary Brown",,Yes
MTHM_2022-12-002,IHIH_ComingSoon.jpg,,,Mark Twain Library (Daybed),John Hawkins,c.1980s,Woodblock print,Culture; Arts; Visual Arts; Etching; Environment; Built Environment; Buildings/Architecture,John Hawkins,"351 Farmington Ave, Hartford, Connecticut ",41.76705545,-72.70141583,The Mark Twain House and Museum,2022.12.2,Image;StillImage,image/jpeg,eng,"Each contributing institution has their own guidelines and rules for use of their collections. The institution is listed as the source of the item. Please contact the individual institution for their terms of use, or reproduction fees, or terms for reproductions. ","Each contributing institution has their own guidelines and rules for use of their collections. The institution is listed as the source of the item. Please contact the individual institution for their terms of use, or reproduction fees, or terms for reproductions. ","The Mark Twain House & Museum, Gift of Mary Brown",,Yes
MTHM_2022-12-003,IHIH_ComingSoon.jpg,,,Mark Twain Library (Alcove),John Hawkins,c.1980s,Woodblock print,Culture; Arts; Visual Arts; Etching; Environment; Built Environment; Buildings/Architecture,John Hawkins,"351 Farmington Ave, Hartford, Connecticut ",41.76705545,-72.70141583,The Mark Twain House and Museum,2022.12.3,Image;StillImage,image/jpeg,eng,"Each contributing institution has their own guidelines and rules for use of their collections. The institution is listed as the source of the item. Please contact the individual institution for their terms of use, or reproduction fees, or terms for reproductions. ","Each contributing institution has their own guidelines and rules for use of their collections. The institution is listed as the source of the item. Please contact the individual institution for their terms of use, or reproduction fees, or terms for reproductions. ","The Mark Twain House & Museum, Gift of Mary Brown",,Yes
MTHM_2023-20-001,IHIH_ComingSoon.jpg,,,Home of the Wordsmith,Gloria Larson,,Collage,Culture; Arts; Visual Arts; Collage; Environment; Built Environment; Buildings/Architecture,Gloria Larson,"351 Farmington Ave, Hartford, Connecticut ",41.76705545,-72.70141583,The Mark Twain House and Museum,2023.20.001,Image;StillImage,image/jpeg,eng,"Each contributing institution has their own guidelines and rules for use of their collections. The institution is listed as the source of the item. Please contact the individual institution for their terms of use, or reproduction fees, or terms for reproductions. ","Each contributing institution has their own guidelines and rules for use of their collections. The institution is listed as the source of the item. Please contact the individual institution for their terms of use, or reproduction fees, or terms for reproductions. ","The Mark Twain House & Musuem, Gift of Chris Nelson",,Yes
MTHM_2023-76,IHIH_ComingSoon.jpg,,,Hartford Pubic High School Report,Hartford Public Schools,,"4 Hartford High School report cards. Listing of pupils including Suzy Clemens, her contempories and friends, with their rank in scholership, deportment, and attendance. They are for Month ending: June 2, 1887, June 24, 1887, October 7th 1887, December 23, 1887. In all, Suzy is listed in 4th class classics. All reports have been folded in thirds, and have small tears where they have been folded",Social;Identity;Education,Suzy Clemens,,,,The Mark Twain House and Museum,2023.76,Image;StillImage,image/jpeg,eng,"Each contributing institution has their own guidelines and rules for use of their collections. The institution is listed as the source of the item. Please contact the individual institution for their terms of use, or reproduction fees, or terms for reproductions. ","Each contributing institution has their own guidelines and rules for use of their collections. The institution is listed as the source of the item. Please contact the individual institution for their terms of use, or reproduction fees, or terms for reproductions. ","The Mark Twain House & Museum, Gift of Mrs. Joseph Brown",,Yes
MTHM_2024-05-001,2024-05-001_f.jpg,,,Jaycee's Pin featuring the Mark Twain House,,,,Culture; Arts; Visual Arts; Sculpture; Environment; Built Environment; Buildings/Architecture; Social; Clubs/Organizations; Jaycees; Fashion; Adornment; Political,,"351 Farmington Ave, Hartford, Connecticut ",41.76705545,-72.70141583,The Mark Twain House and Museum,2024.05.001,Image;StillImage,image/jpeg,eng,"Each contributing institution has their own guidelines and rules for use of their collections. The institution is listed as the source of the item. Please contact the individual institution for their terms of use, or reproduction fees, or terms for reproductions. ","Each contributing institution has their own guidelines and rules for use of their collections. The institution is listed as the source of the item. Please contact the individual institution for their terms of use, or reproduction fees, or terms for reproductions. ","The Mark Twain House and Museum, Museum Purchase",A Connecticut Jaycee's club pin in the shape of the Mark Twain House. Jaycee's is short for the United States Junior Chamber which is a leadership training service organization.,Yes
MTHM_2024-05-001,2024-05-001_b.jpg,,,Jaycee's Pin featuring the Mark Twain House,,,,Culture; Arts; Visual Arts; Sculpture; Environment; Built Environment; Buildings/Architecture; Social; Clubs/Organizations; Jaycees; Fashion; Adornment; Political,,"351 Farmington Ave, Hartford, Connecticut ",41.76705545,-72.70141583,The Mark Twain House and Museum,2024.05.001,Image;StillImage,image/jpeg,eng,"Each contributing institution has their own guidelines and rules for use of their collections. The institution is listed as the source of the item. Please contact the individual institution for their terms of use, or reproduction fees, or terms for reproductions. ","Each contributing institution has their own guidelines and rules for use of their collections. The institution is listed as the source of the item. Please contact the individual institution for their terms of use, or reproduction fees, or terms for reproductions. ","The Mark Twain House and Museum, Museum Purchase",A Connecticut Jaycee's club pin in the shape of the Mark Twain House. Jaycee's is short for the United States Junior Chamber which is a leadership training service organization.,Yes
MTHM_2024-05-002,2024-05-002_b.jpg,,,Smashed Penny from the Mark Twain House,,,,Culture; Arts; Visual Arts; sculpture; Environment; Built Environment; Buildings/Architecture,,"351 Farmington Ave, Hartford, Connecticut ",41.76705545,-72.70141583,The Mark Twain House and Museum,2024.05.002,Image;StillImage,image/jpeg,eng,"Each contributing institution has their own guidelines and rules for use of their collections. The institution is listed as the source of the item. Please contact the individual institution for their terms of use, or reproduction fees, or terms for reproductions. ","Each contributing institution has their own guidelines and rules for use of their collections. The institution is listed as the source of the item. Please contact the individual institution for their terms of use, or reproduction fees, or terms for reproductions. ","The Mark Twain House and Museum, Museum Purchase",Souvenir smashed penny from the Mark Twain House & Museum,Yes
MTHM_2024-05-002,2024-05-002_f.jpg,,,Smashed Penny from the Mark Twain House,,,,Culture; Arts; Visual Arts; sculpture; Environment; Built Environment; Buildings/Architecture,,"351 Farmington Ave, Hartford, Connecticut ",41.76705545,-72.70141583,The Mark Twain House and Museum,2024.05.002,Image;StillImage,image/jpeg,eng,"Each contributing institution has their own guidelines and rules for use of their collections. The institution is listed as the source of the item. Please contact the individual institution for their terms of use, or reproduction fees, or terms for reproductions. ","Each contributing institution has their own guidelines and rules for use of their collections. The institution is listed as the source of the item. Please contact the individual institution for their terms of use, or reproduction fees, or terms for reproductions. ","The Mark Twain House and Museum, Museum Purchase",Souvenir smashed penny from the Mark Twain House & Museum,Yes
MTHM_2024-05-003,2024-05-003_bd.jpg,,,Admissions Ticket,,12/1/1971,,Economic; Finance; Banking; Environment,,"351 Farmington Ave, Hartford, Connecticut ",41.76705545,-72.70141583,The Mark Twain House and Museum,2024.05.003,Image;StillImage,image/jpeg,eng,"Each contributing institution has their own guidelines and rules for use of their collections. The institution is listed as the source of the item. Please contact the individual institution for their terms of use, or reproduction fees, or terms for reproductions. ","Each contributing institution has their own guidelines and rules for use of their collections. The institution is listed as the source of the item. Please contact the individual institution for their terms of use, or reproduction fees, or terms for reproductions. ","The Mark Twain House and Museum, Museum Purchase","Two connected vintage admissions tickets for the Mark Twain House in Hartford, Connecticut. The ticket indicates that admission cost is $1.25 per adult. The ticket numbers are 000715 and 000716. The back of each tickets are stamped Dec. 1 -1971. ",Yes
MTHM_2024-05-003,2024-05-003_b.jpg,,,Admissions Ticket,,12/1/1971,,Economic; Finance; Banking; Environment,,"351 Farmington Ave, Hartford, Connecticut ",41.76705545,-72.70141583,The Mark Twain House and Museum,2024.05.003,Image;StillImage,image/jpeg,eng,"Each contributing institution has their own guidelines and rules for use of their collections. The institution is listed as the source of the item. Please contact the individual institution for their terms of use, or reproduction fees, or terms for reproductions. ","Each contributing institution has their own guidelines and rules for use of their collections. The institution is listed as the source of the item. Please contact the individual institution for their terms of use, or reproduction fees, or terms for reproductions. ","The Mark Twain House and Museum, Museum Purchase","Two connected vintage admissions tickets for the Mark Twain House in Hartford, Connecticut. The ticket indicates that admission cost is $1.25 per adult. The ticket numbers are 000715 and 000716. The back of each tickets are stamped Dec. 1 -1971. ",Yes
MTHM_2024-05-003,2024-05-003_f.jpg,,,Admissions Ticket,,12/1/1971,,Economic; Finance; Banking; Environment,,"351 Farmington Ave, Hartford, Connecticut ",41.76705545,-72.70141583,The Mark Twain House and Museum,2024.05.003,Image;StillImage,image/jpeg,eng,"Each contributing institution has their own guidelines and rules for use of their collections. The institution is listed as the source of the item. Please contact the individual institution for their terms of use, or reproduction fees, or terms for reproductions. ","Each contributing institution has their own guidelines and rules for use of their collections. The institution is listed as the source of the item. Please contact the individual institution for their terms of use, or reproduction fees, or terms for reproductions. ","The Mark Twain House and Museum, Museum Purchase","Two connected vintage admissions tickets for the Mark Twain House in Hartford, Connecticut. The ticket indicates that admission cost is $1.25 per adult. The ticket numbers are 000715 and 000716. The back of each tickets are stamped Dec. 1 -1971. ",Yes
MTHM_2024-05-003,2024-05-003_fd.jpg,,,Admissions Ticket,,12/1/1971,,Economic; Finance; Banking; Environment,,"351 Farmington Ave, Hartford, Connecticut ",41.76705545,-72.70141583,The Mark Twain House and Museum,2024.05.003,Image;StillImage,image/jpeg,eng,"Each contributing institution has their own guidelines and rules for use of their collections. The institution is listed as the source of the item. Please contact the individual institution for their terms of use, or reproduction fees, or terms for reproductions. ","Each contributing institution has their own guidelines and rules for use of their collections. The institution is listed as the source of the item. Please contact the individual institution for their terms of use, or reproduction fees, or terms for reproductions. ","The Mark Twain House and Museum, Museum Purchase","Two connected vintage admissions tickets for the Mark Twain House in Hartford, Connecticut. The ticket indicates that admission cost is $1.25 per adult. The ticket numbers are 000715 and 000716. The back of each tickets are stamped Dec. 1 -1971. ",Yes
MTHM_2024-06-001,IHIH_ComingSoon.jpg,,,Mark Twain Memorial Puzzle,Unknown,,,Culture; Arts; Visual Arts; Photography; Social; Cultural; Sports & Recreation; Toys; Environment; Built Environment; Buildings/Architecture,,,,,The Mark Twain House and Museum,2024.06.001,Image;StillImage,image/jpeg,eng,"Each contributing institution has their own guidelines and rules for use of their collections. The institution is listed as the source of the item. Please contact the individual institution for their terms of use, or reproduction fees, or terms for reproductions. ","Each contributing institution has their own guidelines and rules for use of their collections. The institution is listed as the source of the item. Please contact the individual institution for their terms of use, or reproduction fees, or terms for reproductions. ","The Mark Twain House & Museum, Staff Collect",12x18 inch Puzzel featuring a photograph of the Mark Twain House,Yes
